{
  "schema_version": "1.0-ms1",
  "run": {
    "run_id": "bca1cef2ba6c_037",
    "started_at": "2026-04-08T22:25:14.525+00:00",
    "ended_at": "2026-04-08T22:25:55.550+00:00",
    "framework": "single_model_pipeline",
    "deterministic": true,
    "parameters": {
      "base_model": "unsloth/Qwen3-1.7B-bnb-4bit",
      "quantization": "4bit",
      "adapter_method": "qlora",
      "seed": 42,
      "learning_rate": 0.0002,
      "batch_size": 1,
      "gradient_accumulation_steps": 1,
      "max_steps": 1269,
      "max_seq_length": 8192,
      "temperature": 0.0
    }
  },
  "contract": {
    "contract_id": "66",
    "source_type": "txt",
    "source_name": "Clause-de-non-divulgation.pdf",
    "language": "en",
    "hash_sha256": "15dceac80dc059052669b60edc0f031c7ac410506f5bc723f96f982c07808c6e",
    "chunks": [
      {
        "chunk_id": "chunk_000",
        "text": "ANNEX 2 - Non Disclosure",
        "span": {
          "char_start": 0,
          "char_end": 25
        }
      },
      {
        "chunk_id": "chunk_001",
        "text": "Agreement",
        "span": {
          "char_start": 25,
          "char_end": 34
        }
      },
      {
        "chunk_id": "chunk_002",
        "text": "Date:",
        "span": {
          "char_start": 35,
          "char_end": 40
        }
      },
      {
        "chunk_id": "chunk_003",
        "text": "THIS AGREEMENT IS ENTERED INTO BY AND BETWEEN:",
        "span": {
          "char_start": 41,
          "char_end": 87
        }
      },
      {
        "chunk_id": "chunk_004",
        "text": "DEFTA Group",
        "span": {
          "char_start": 88,
          "char_end": 99
        }
      },
      {
        "chunk_id": "chunk_005",
        "text": "A compagny having its registered office at MEAUX Val d'Europe 77701",
        "span": {
          "char_start": 100,
          "char_end": 167
        }
      },
      {
        "chunk_id": "chunk_007",
        "text": "Immeuble Le Galil\u00e9e, 10 Rue de la Fontaine Rouge.",
        "span": {
          "char_start": 169,
          "char_end": 219
        }
      },
      {
        "chunk_id": "chunk_008",
        "text": "Val d'Europe - Marne La Vall\u00e9e - 77701",
        "span": {
          "char_start": 219,
          "char_end": 257
        }
      },
      {
        "chunk_id": "chunk_009",
        "text": "Represented by Jean-Fran\u00e7ois",
        "span": {
          "char_start": 258,
          "char_end": 287
        }
      },
      {
        "chunk_id": "chunk_010",
        "text": "KER RAULT",
        "span": {
          "char_start": 287,
          "char_end": 296
        }
      },
      {
        "chunk_id": "chunk_011",
        "text": "Group Purchasing Director",
        "span": {
          "char_start": 297,
          "char_end": 322
        }
      },
      {
        "chunk_id": "chunk_012",
        "text": "Hereinafter called \"Buyer\"",
        "span": {
          "char_start": 323,
          "char_end": 349
        }
      },
      {
        "chunk_id": "chunk_013",
        "text": "AND",
        "span": {
          "char_start": 350,
          "char_end": 353
        }
      },
      {
        "chunk_id": "chunk_014",
        "text": "VWX",
        "span": {
          "char_start": 354,
          "char_end": 357
        }
      },
      {
        "chunk_id": "chunk_015",
        "text": "A company having its registered office at YYY",
        "span": {
          "char_start": 358,
          "char_end": 403
        }
      },
      {
        "chunk_id": "chunk_016",
        "text": "Represented by YYY",
        "span": {
          "char_start": 404,
          "char_end": 422
        }
      },
      {
        "chunk_id": "chunk_017",
        "text": "its YYY",
        "span": {
          "char_start": 423,
          "char_end": 430
        }
      },
      {
        "chunk_id": "chunk_018",
        "text": "Hereinafter called \"Supplier\"",
        "span": {
          "char_start": 431,
          "char_end": 460
        }
      },
      {
        "chunk_id": "chunk_019",
        "text": "Buyer and the Supplier are together hereinafter referred to as \"Parties\", and individually \"Party\".",
        "span": {
          "char_start": 461,
          "char_end": 560
        }
      },
      {
        "chunk_id": "chunk_020",
        "text": "WITNESSES",
        "span": {
          "char_start": 561,
          "char_end": 570
        }
      },
      {
        "chunk_id": "chunk_021",
        "text": "WHEREAS, the Parties wish to pursue exploratory discussions concerning possible collaborations between them in relation to project XXX.",
        "span": {
          "char_start": 571,
          "char_end": 706
        }
      },
      {
        "chunk_id": "chunk_022",
        "text": "WHEREAS, during the performance of this Purchasing Frame Contract, it will become necessary for the Parties hereto to disclose to each other certain technical, financial or business information of a proprietary or confidential nature, hereinafter referred to as \u201cProprietary Information\u201d; and",
        "span": {
          "char_start": 707,
          "char_end": 999
        }
      },
      {
        "chunk_id": "chunk_023",
        "text": "WHEREAS, the Parties hereto are willing to provide for the conditions of such disclosure of Proprietary Information and the rules governing the use and the protection there of;",
        "span": {
          "char_start": 1000,
          "char_end": 1176
        }
      },
      {
        "chunk_id": "chunk_024",
        "text": "NOW, THEREFORE, THE PARTIES AGREE AS FOLLOWS:",
        "span": {
          "char_start": 1177,
          "char_end": 1222
        }
      },
      {
        "chunk_id": "chunk_025",
        "text": "1. As used in this Agreement the term \"Proprietary Information\" shall mean any information or data disclosed by any Party to the other, pursuant to this Agreement, either in writing or orally, subject to the conditions set forth hereafter, and including without limitation any written or printed documents (plans, drawings, photographs, etc\u2026), samples prototypes, models, technology, know-how, specifications, software, commercial or financial information or any means of disclosing such Proprietary Information that each Party may elect to use during the life of this Agreement.",
        "span": {
          "char_start": 1223,
          "char_end": 1802
        }
      },
      {
        "chunk_id": "chunk_026",
        "text": "2. Nothing in this Agreement may be construed as compelling any Party hereto to disclose any Proprietary Information to the other, or to enter into any further contractual relationships.",
        "span": {
          "char_start": 1803,
          "char_end": 1989
        }
      },
      {
        "chunk_id": "chunk_027",
        "text": "3. Each Party, to the extent of its right to do so, shall disclose to the other Party the Proprietary Information which are appropriate to fulfil the objectives of this Agreement as set up in the recitals.",
        "span": {
          "char_start": 1990,
          "char_end": 2196
        }
      },
      {
        "chunk_id": "chunk_028",
        "text": "The Parties hereby represent that the disclosure of Proprietary Information by and between themselves is not contrary to the laws and regulations of their respective countries.",
        "span": {
          "char_start": 2196,
          "char_end": 2372
        }
      },
      {
        "chunk_id": "chunk_029",
        "text": "4. The receiving Party hereby covenants that, during the validity period of this Agreement and for a period of five (5) years after its end or its termination, the Proprietary Information received from the disclosing Party shall:",
        "span": {
          "char_start": 2373,
          "char_end": 2602
        }
      },
      {
        "chunk_id": "chunk_030",
        "text": "(a) be protected and kept in strict confidence by the receiving Party which must use the same degree of precaution and safeguards as it uses to protect its own proprietary information of like importance, but in no case any less than reasonable care,",
        "span": {
          "char_start": 2603,
          "char_end": 2852
        }
      },
      {
        "chunk_id": "chunk_031",
        "text": "(b) be only disclosed to and used by those persons who have a need to know and solely for the purpose specified in this Agreement, within the receiving Party's organisation and to its professional advisors, provided that in this latter case the disclosing Party so notifies the other Party and obtains the authorization from the other Party to make such disclosure, such authorization not being unreasonably withheld, and provided that such advisor(s) agree(s) to be bound by the terms and conditions of this Agreement.",
        "span": {
          "char_start": 2853,
          "char_end": 3373
        }
      },
      {
        "chunk_id": "chunk_032",
        "text": "(Buyer shall be entitled to freely disclose such information to its affiliated companies, to its co -contractors for a project and to its final customer).",
        "span": {
          "char_start": 3373,
          "char_end": 3527
        }
      },
      {
        "chunk_id": "chunk_033",
        "text": "(c) not be used in whole or in part for any purpose other than the purpose of this Agreement as specified in the preamble and for the Project above without the prior written consent of the disclosing Party,",
        "span": {
          "char_start": 3528,
          "char_end": 3734
        }
      },
      {
        "chunk_id": "chunk_034",
        "text": "(d) neither be disclosed nor caused to be disclosed whether directly or indirectly to any third Party or persons other than those mentioned in subparagraph",
        "span": {
          "char_start": 3735,
          "char_end": 3891
        }
      },
      {
        "chunk_id": "chunk_035",